show,title,href,id,show_abbrev,show_c
Amanpour,"Tehran Closed for Diplomacy; Trump Says Any Iran Attacks Will be Met with Force and Even Obliteration; Iraq Worried About Being Caught in the Maelstrom; Barham Salih, Iranian President, is Interviewed About the Tension Between the U.S. and Iran; U.S. Government's Treatment of Detained Migrant Children Under Scrutiny; Immigrant Children Living Unsafe and Unsanitary Detention Facilities; Warren Binford, Professor of Law, Willamette University, is Interviewed About U.S. Detention Facilities. Aired 1-2p ET",/TRANSCRIPTS/1906/25/ampr.01.html,52020,ampr,amanpour
Amanpour,"Jared Kushner Reveals First Sector of U.S.-Middle East Peace Plan; Palestinians Boycotts Kushner's Middle East Conference; Mohammad Shtayyeh, Palestinian Authority Prime Minister, is Interviewed About Kushner's Peace Plan; Fight to Achieve Equal Justice Under Law; HBO's New Documentary, ""True Justice""; Bryan Stevenson, Founder and Executive Director, Equal Justice Initiative, is Interviewed About the U.S. Supreme Court. Aired 1-2p ET",/TRANSCRIPTS/1906/24/ampr.01.html,52021,ampr,amanpour
Amanpour,"Trump Nominates Mark Esper as Next Defense Secretary; What it Takes to Run the Pentagon; Ash Carter, Author, ""Inside the Five-Sided Box,"" is Interviewed About the Pentagon; Mavis Staples Turns 80 and With a New Album, ""We Get By""; Mavis Staples, Gospel and R&B Singer, is Interviewed About Her New Album. Aired 1-2p ET",/TRANSCRIPTS/1906/21/ampr.01.html,52022,ampr,amanpour
Amanpour,"Iran Shots U.S. Drone, Trump Says Iran Made a Big Mistake; U.N. Special Rapporteur Released Independent Investigation on Jamal Khashoggi Murder; Adel al-Jubeir, Saudi Arabian Minister of State for Foreign Affairs, is Interviewed About the U.N. Special Rapporteur`s Investigation; Will U.S. Retaliate to Iran for Downing Down Drone?; A Road Map to De- Escalation between Iran and the United States; Gerard Araud, Former French Ambassador to the United States, is Interviewed About Iran and U.S. Itzhak Perlman, Greatest Living Violinist; Itzhak Perlman, Violinist and Conductor, is Interviewed About Teaching. Aired 1-2p ET",/TRANSCRIPTS/1906/20/ampr.01.html,52023,ampr,amanpour
Amanpour,"British Politics, The Fight To become the Next Conservative Party Leader; Boris Johnson Frontrunner to Become Prime Minister; Who is Boris Johnson?; Fraser Nelson, Editor, The Spectator, and Martin Fletcher, Former Foreign Editor, The Times of London, are Interviewed About Boris Johnson; Valerie Johnson's New Book, ""Finding My Voice: My Journey to the West Wing and the Path Forward""; Valerie Jarrett, Former Senior Advisor to President Barack Obama, is Interviewed About Democratic Presidential Hopefuls and Her Book. Aired 1-2p ET",/TRANSCRIPTS/1906/19/ampr.01.html,52024,ampr,amanpour
Amanpour,"Trump Re-Election Campaign in Florida; U.S. Sending Additional Military Resources to the Middle East; Sen. Rick Scott (R-FL), is Interviewed About Trump's Re-Election and Health Care; Mohamed Morsi Dies and Denied a Public Burial; Mohamed Morsi's Conditions While Detained; Crispin Blunt, British Conservative MP, is Interviewed About Mohamed Morsi and Egypt. Aired 1-2p ET",/TRANSCRIPTS/1906/18/ampr.01.html,52025,ampr,amanpour
Amanpour,"U.S. Says Iran is ""No Doubt"" Behind Tanker Attacks; Iran Threatens to Exceed Limits on Uranium Stockpile and Enrichment Levels; Hamid Baeidinejad, Iranian Ambassador to the U.S., is Interviewed About Iran-U.S. Confrontation; William Burns' New Book, ""The Back Channel""; William Burns, Former U.S. Deputy Secretary of State, is Interviewed About Iran; Protests in Hong Kong Continues; Hong Kong Protesters Demand Extradition Bill be Fully Withdrawn. Aired 1-2p ET",/TRANSCRIPTS/1906/17/ampr.01.html,52026,ampr,amanpour
Amanpour,"Fascism In Italy; Matteo Salvini Brings His Campaign To Washington; Immigration In Italy; Matteo Salvini, Deputy Italian Prime Minister, Is Interviewed About Italy And His Visit To Washington; Elizabeth Tilson's New Series, ""The Loudest Voice;"" Sienna Miller, Actress, ""American Woman,"" Is Interviewed About Her Career. Aired 1-2p ET",/TRANSCRIPTS/1906/14/ampr.01.html,52027,ampr,amanpour
Amanpour,"Miscarriage of Justice in America; Black People More Likely to Wrongfully Convicted of Murder than White People; Keith Bush, Exonerated after 33 Years in Prison, and Nina Morrison, Senior Litigation Counsel, Innocence Project, are Interviewed About the Justice System in America; Colombia's Peace at Risk; Sergio Jaramillo, Former Lead Peace Negotiator in Colombia, is Interviewed About Colombia's Peace Deal. Aired 1-2p ET",/TRANSCRIPTS/1906/13/ampr.01.html,52028,ampr,amanpour
Amanpour,"Hong Kong Police Fires Tear Gas and Rubber Bullets to Protesters in Hong Kong; Hong Kong Chief Executive Defends Her Decision on Extradition Bill; Emily Lau, Former Chair. Hong Kong Democratic Party, is Interviewed About Hong Kong's Extradition Bill; ""Bellingcat - Truth in a Post-Truth World,"" a New Documentary; Bellingcat Investigates Downing of MH17; Eliot Higgins, Founder, Bellingcat, and Christiaan Triebert, Journalist, The New York Times, are Interviewed About Bellingcat. Aired 1-2p ET",/TRANSCRIPTS/1906/12/ampr.02.html,52029,ampr,amanpour
Amanpour,"Trump Threatens China Another $300 Billion on Tariffs; China's Retaliation Can Devastate U.S. Industries; Maine Joins in Suing Purdue Pharma for Opioid Crisis; Sen. Angus King (I-ME), is Interviewed About U.S and China's Trade War and Addiction Crisis; Opioid Crisis in the U.S.; Andy Beshear, Kentucky Attorney General, and Abbe Gluck, Professor, Yale Law School, are Interviewed About the Opioid Epidemic in the U.S. Aired 1-2p ET",/TRANSCRIPTS/1906/11/ampr.01.html,52030,ampr,amanpour
Amanpour,"Abdel Fattah el-Sisi, A Flagrant Human Rights Abuser; British Human Rights Organization`s New Report on Egypt; Ibrahim Halawa, Former Prisoner in Egypt, and Maya Foa, Director of Reprieve, are Interviewed About Egypt; John Water`s New Book, ""Mr. Know-It-All""; John Waters, Author, ""Mr. Know- It-All,"" is Interviewed About his New Book. Aired 1-2p ET",/TRANSCRIPTS/1906/07/ampr.02.html,52031,ampr,amanpour
Amanpour,"John Waters' Memoir; The Adaptation of Little Women; Abdel Fattah el-Sisi, A Flagrant Human Rights Abuser; British Human Rights Organization's New Report on Egypt; Ibrahim Halawa, Former Prisoner in Egypt, and Maya Foa, Director of Reprieve, are Interviewed About Egypt; John Water's New Book, ""Mr. Know-It-All""; John Waters, Author, ""Mr. Know- It-All,"" is Interviewed About his New Book. Aired 1-2p ET",/TRANSCRIPTS/1906/07/ampr.01.html,52032,ampr,amanpour
Amanpour,"75th Anniversary of D-Day; Trump and Macron Side by Side Paying Tribute in Normandy; Jake Larson, D-Day Veteran, and Carlisle Salapare, U.S. High School Student, are Interviewed About D-Day; Remembering D-Day 75 Years Ago; Antony Beevor, Military Historian, is Interviewed About D-Day; Instilling the Patriotism of WWII Veterans in the Soldiers of Today; Commemorating the 75th Anniversary of D-Day. Aired 1-2p ET",/TRANSCRIPTS/1906/06/ampr.01.html,52033,ampr,amanpour
Amanpour,"Trump Joins Queen Elizabeth II for 75th D-Day Anniversary; Jamie McCourt, U.S. Ambassador to France and Monaco, is Interviewed About 75th D- Day Anniversary; Documentary About Rudolf Nureyev; David Morris, Director, ""Nureyev,"" and Dame Sian Phillips, Narrator, ""Nureyev,"" are Interviewed About the Documentary, ""Nureyev."" Aired 1-2p ET",/TRANSCRIPTS/1906/05/ampr.01.html,52034,ampr,amanpour
Amanpour,"Trump Visit to Britain Day Two; Prime Minister May Citing 75th Anniversary of D-Day; Trump Putting Tariffs on Mexico Over Immigration; Christopher Ruddy, President and CEO, Newsmax Media Inc., is Interviewed About Trump's State Visit to Britain; Vince Cable, Leader, British Liberal Democrats, is Interviewed About Trump's State Visit; Prime Minister May Asks Trump on Climate Change; Bob Inglis (R-SC), Former U.S. House Representative , and Katharine Hayhoe, Atmospheric Scientist, Texas Tech University, are Interviewed About Climate Change. Aired 1-2p ET",/TRANSCRIPTS/1906/04/ampr.01.html,52035,ampr,amanpour
Amanpour,"Trump Arrives in London for a Three-Day State Visit; The Future Relationship Between the United States and the United Kingdom; Nigel Sheinwald, Former British Ambassador to the U.S., is Interviewed About U.S and U.K. Relationship; Trump Says He is the Least Racist Person; Reliving the Injustice and Humanizing Those Falsely Accused; Ava DuVernay, Creator, Co-Writer & Director, ""When They See Us,"" is Interviewed About Her New Netflix Series. Aired 1-2p ET",/TRANSCRIPTS/1906/03/ampr.01.html,52036,ampr,amanpour
Amanpour,"Robert Caro, America's Greatest Living Biographer; Robert Caro, Author, ""Working: Researching, Interviewing, Writing,"" is Interviewed About His Life's Work and Lyndon Johnson; Israelis Voting for Benjamin Netanyahu's Fourth Consecutive Term; Ayelet Gundar-Goshen, Clinical Psychologist, is Interview About the Psyche of the Israeli People; Ayelet Gundar-Goshen, Clinical Psychologist Is Interviewed about the Psyche of the Israeli People; Discussing the Film The Public. Aired 1-2p ET",/TRANSCRIPTS/1905/31/ampr.01.html,52037,ampr,amanpour
Amanpour,"Murder Rate in London to Chicago; Mikey Davis, Program Specialist, Cure Violence, and Mahamed Hashi, Youth Worker, are Interviewed About Murders in London and Chicago; Sexual Abuse Getting Worse; Lori Halse Anderson, Author, ""Shout,"" is Interviewed About Sexual Abuse. Aired 1-2p ET",/TRANSCRIPTS/1905/30/ampr.01.html,52038,ampr,amanpour
Amanpour,"Nazi Daughter, Conducting Campaign to Never Forget Holocaust; Hilde Schramm; Hilde Schramm, Founder, The Return Foundation, is Interviewed About Her Father, Albert Speer, and the Holocaust; Devoting Life to Contest Evil in All its Forms; Deborah Lipstadt's New Book, ""Antisemitism: Here and Now""; Deborah Lipstadt, Author, ""Antisemitism: Here And Now,"" is Interviewed About anti-Semitism and Her New Book. Aired 1-2p ET",/TRANSCRIPTS/1905/29/ampr.01.html,52039,ampr,amanpour
Amanpour,"Interview with the First Female Chancellor and the Most Powerful Woman in the World; Angela Merkel, German Chancellor, is Interviewed About Europe and America; Ron Howard's New Documentary About Luciano Pavarotti; Ron Howard, Director, ""Pavarotti,"" is Interviewed About his New Documentary, ""Pavarotti."" Aired 1-2p ET",/TRANSCRIPTS/1905/28/ampr.01.html,52040,ampr,amanpour
Amanpour,"Bipartisanship Answer to Climate Crisis; Deutch's Carbon Tax Receives Bipartisan Support; Rep. Ted Deutch (D-FL), is Interviewed About Climate Change, Gun Control and Russian Hacking; The Extraordinary Life of Frederick Douglass; David Blight, Author, ""Frederick Douglas: Prophet of Freedom,"" is Interviewed About Frederick Douglas. Aired 1-2p ET",/TRANSCRIPTS/1905/27/ampr.01.html,52041,ampr,amanpour
Amanpour,"Theresa May Announces Resignation; What Will Happen Between Europe and Britain?; Fraser Nelson, Editor, The Spectator, and Carl Bildt, Co- Chair, European Council on Foreign Relations, are Interviewed about Theresa May and U.K.; Nerdiest President Campaign in History; Andrew Yang, (D), Presidential Candidate, is Interviewed About Why his Running for President. Aired 1-2p ET",/TRANSCRIPTS/1905/24/ampr.01.html,52042,ampr,amanpour
Amanpour,"Trump and Pelosi Engaged in War of Words; U.S. President Refuses to Work with Congress; Political Dysfunction in America; E.J. Dionne, Washington Post Columnist, and Norman Ornstein, Scholar, American Enterprise Institute, are Interviewed About Political Dysfunction; EPA Changing Ways to Calculate Health Risks of Air Pollution; John Bachman, Former EPA Associated Director for Science/Policy, is Interviewed About Air Pollution; Environmental Protection Laws; Increase Civic Engagement. Aired 1-2p ET",/TRANSCRIPTS/1905/23/ampr.01.html,52043,ampr,amanpour
Amanpour,"White House Pushes Ahead with Peace Plan for Israel and Palestine; Palestinians Weren't Consulted for White House's Decision for the Conference; Kori Schake, Deputy Director-General, IISSI, Karin von Hippel, Director-General, Royal United Services Institute, and Mark Hannah, Senior Fellow, The Eurasia Group Foundation, are Interviewed About Israel and Palestine Peace Plan; Student Loan, Second Largest Category of Household Debt in U.S.; Susan Dynarski, Professor of Public Policy, University of Michigan, is Interviewed About Student Loans;  . Aired 1-2p ET",/TRANSCRIPTS/1905/22/ampr.01.html,52044,ampr,amanpour
Amanpour,"Tension Between U.S. and Iran High, Yet Both Don't Want War; Iranian Prime Minister Worried About Accidental Warfare; David Petraeus, Former Commanding General, Multi-national Force in Iraq, is Interviewed About Iran and Iraq. Congressman Nominates Jose Andres for Nobel Peace Prize; Jose Andres, Michelin Star Chef & Author, ""Vegetables Unleased,"" is Interviewed About Vegetables and His New Book. Aired 1-2p ET",/TRANSCRIPTS/1905/21/ampr.01.html,52045,ampr,amanpour
Amanpour,"Trump Accuses James Baker for Attempted Coup Against His Presidency; Russia's Assault on Western Democracy Continues; James Baker, Former General Counsel, FBI, is Interviewed About Trump and Russia; Rise of Fringe Parties in Europe; Anne Applebaum, Columnist, The Washington Post, is Interviewed About Fringe Parties Having Links to Russia. Aired 1-2p ET",/TRANSCRIPTS/1905/20/ampr.01.html,52046,ampr,amanpour
Amanpour,"United States' Strategy Around the Clouds of War; Seven Months After Jamal Khashoggi's Murder, Still No Efforts By U.S. and Saudi Arabia; Robin Wright, Contributing Writer, The New Yorker, is Interviewed About Wars and Her New Book, ""Is Trump Yet Another U.S. President Provoking a War?"": Hatice Cengiz, Jamal Khashoggi's Fiance, is Interviewed Testifying Before Congress; Publishers, Editors and Reporters are Taking the Stand for Values and Truth; Radhika Jones, Editor-in-Chief, Vanity Fair, is Interviewed About ""Vanity Fair""; Vanity Fair's Editor's First Year in Charge; Knock Down the House. Aired 1-2p ET",/TRANSCRIPTS/1905/17/ampr.01.html,52047,ampr,amanpour
Amanpour,"Trump Barring Huawei to do Business with U.S.; Huawei a National Threat; Jim Sciutto, CNN Chief National Security Correspondent, is Interviewed About China and His New Book, ""The Shadow War""; Alabama's Governor Signs Most Restrictive Abortion Law; Governor Kay Ivey Signs Human Life Protection Act; Gloria Steinem, Women's Right Activist, is Interviewed About Abortion; Abortion Laws; Foreign Aid. Aired 1-2p ET",/TRANSCRIPTS/1905/16/ampr.01.html,52048,ampr,amanpour
Amanpour,"U.S. and Iran Insists Neither Wants to Go to War; Sen. Tom Cotton (R-AR), is Interviewed About U.S. and Iran War and About his New Book, ""Sacred Duty""; Sen. Tim Kaine (D-VA), is Interviewed About U.S. and Iran War. Aired 1-2p ET",/TRANSCRIPTS/1905/15/ampr.01.html,52049,ampr,amanpour
Amanpour,"A Call to Big Titans to Ban the Use of Social Media as a Terrorist Weapon; Prime Minister Jacinda Ardern Rallying the World; Jacinda Ardern, New Zealand Prime Minister, is Interviewed About Online and Violent Extremism and Gun Law; Masha Gessen, Staff Writer, ""The New Yorker,"" is Interviewed About Her New Book and the Mueller Report. Aired 1-2p ET",/TRANSCRIPTS/1905/14/ampr.01.html,52050,ampr,amanpour
Amanpour,"Big Tech, Too Big, Too Powerful; World Leaders Getting Grips with All-Powerful Monopolies; Tech Leaders Rejects Government Intervention; Eric Schmidt, Former Google CEO and Co-Author, ""Trillion Dollar Coach,"" and Alan Eagle, Director of Google and Co-Author, ""Trillion Dollar Coach,"" are Interviewed About their New Book and About Technology; 80-Year-Old, Glenda Jackson, is Taking Broadway by Storm. Aired 1-2p ET",/TRANSCRIPTS/1905/13/ampr.01.html,52051,ampr,amanpour
Amanpour,"How Australia's Elections Could Reshape Political Narrative; Waleed Aly, Co-Host, ""The Project,"" is Interviewed About Terrorism and Australia's Upcoming Election; Caring About Your Constitution, Your Rights and Protections; Heidi Schreck, Writer and Actor, ""What the Constitution Means to Me,"" is Interviewed About her New Book; The Realities of Life Inside Guantanamo Bay. Aired 1-2p ET",/TRANSCRIPTS/1905/10/ampr.01.html,52052,ampr,amanpour
Amanpour,"Possibilities and the Limits of American Policy; How Character Affects Foreign Policy; George Packer, Author, ""Our Man,"" is Interviewed About his New Book, ""Our Man""; Single Career Path Not Enough For Us Today; Andrew Scott, Co-Author, ""The 100-Year Life,"" and Paul Irving, Chairman, Milken Institute Center for the Future of Aging, are Interviewed About Living Life to 100; Kate Pakenham Talks about the Play Emilia. Aired 1-2p ET",/TRANSCRIPTS/1905/09/ampr.01.html,52053,ampr,amanpour
Amanpour,"Iran Will Not Pull Out of Nuclear Deal; Tehran Keeps Uranium Rather Than Selling Abroad; Trump Invokes Executive Privileged Over Mueller Report; Sen. Mitt Romney (R-UT) and Sen. Chris Murphy (D-CT), are Interviewed About Iran's Nuclear Deal, Trump's Executive Privilege Over Mueller Report and About Israel and Palestine; Bill Weld Challenges Trump for 2020 Republican Primaries; Bill Weld (R), Presidential Candidate, is Interviewed About 2020 Presidential Election. Aired 1-2p ET",/TRANSCRIPTS/1905/08/ampr.01.html,52054,ampr,amanpour
Amanpour,"China and United States Ramping Up Trade War; Trump Imposing $200 Billion of Tariffs by the End of the Week; Beijing Put Uyghurs in Concentration Camps; Paul Mozur, Technology Reporter, The New York Time, is Interviewed About China's Technology; How Nations React to Crises; Jared Diamond, Author, ""Upheaval: Turning Points for Nations in Crisis,"" is Interviewed About his New Book, ""Upheaval."" Aired 1-2p ET",/TRANSCRIPTS/1905/07/ampr.01.html,52055,ampr,amanpour
Amanpour,"Congressional Panel's Contempt Vote for William Barr; Trump Says Mueller Should Not Testify; Treasury Secretary Missing Two Deadlines For Trump's Tax Returns; Susan Glasser, Susan Glasser, CNN Global Affairs Analyst, and Norman Ornstein, Political Scientist and Congressional Expert, are Interviewed About Constitutional Crisis; Truth About Saudi Arabia's Mass Execution; Madawi Al-Rasheed, Professor, Middle East Center at London School of Economics, is Interviewed About Saudi Arabia's Mass Execution. Aired 1-2p ET",/TRANSCRIPTS/1905/06/ampr.01.html,52056,ampr,amanpour
Amanpour,"Iceland's Prime Minister's Unique Style; Iceland's Ambition, Carbon Neutral by 2040; Katrin Jakobsdottir, Icelandic Prime Minister, is Interviewed About Iceland and Climate Change; How Hardship Can Produce Great Comedy; Craig Ferguson, Comedian and Author, ""Riding the Elephant,"" is Interviewed About his Memoir, ""Riding the Elephant."" Aired 1-2p ET",/TRANSCRIPTS/1905/03/ampr.01.html,52057,ampr,amanpour
Amanpour,"British Parliament First to Declare Environmental Emergency; U.S. House of Representatives Passed its First Major Legislation on Climate; Gavin Newsom (D-CA), is Interviewed About Climate Change and Climate Activists; American's Longest War Enters its Sixth Round of Peace Talks; John Sopko, U.S. Special Inspector General for the Afghanistan Reconstruction, is Interviewed About the War Between the U.S. and Afghanistan; C. Aired 1-2p ET",/TRANSCRIPTS/1905/02/ampr.01.html,52058,ampr,amanpour
Amanpour,"Chair of the House of Intelligence Committee Says Barr Should Resign; Adam Schiff, U.S. House Intelligence Committee Chair, is Interviewed About William Barr`s Decision on the Mueller Report; Joe Biden Rocketed to the Front of the Democratic Presidential Pack; Kimberle Crenshaw, Assisted Anita Hill`s Legal Team, and Barbara Boxer, Former U.S. Senate Democrat, are Interviewed About Joe Biden`s Apology on the Anita Hill Hearing. Aired 1-2p ET",/TRANSCRIPTS/1905/01/ampr.01.html,52059,ampr,amanpour
Amanpour,"Operation Freedom, The Beginning of the Final Phase in Venezuela; Secretary of State, Mike Pompeo, Supports Juan Guaido; Carlos Vecchio, Venezuelan Opposition Leader's U.S. Envoy, is Interviewed About the Situation in Venezuela; NRA Faces Financial Investigation; Robert Draper, Writer-at-large, New York Times Magazine, and Shannon Watts, Founder, Moms Demand Action, are Interviewed About the NRA. Aired 1-2p ET",/TRANSCRIPTS/1904/30/ampr.01.html,52060,ampr,amanpour
Amanpour,"San Diego Synagogue Shooting; Trump Expresses His Condolences To Rabbi Goldstein; Michael German, Fellow, Brenna Center for Justice, is Interviewed About Hate Crimes; Far-Right Party in Spain Win Seats; Yascha Mounk, Associate Professor, Johns Hopkins University, is Interviewed About Far-Right Parties; Sunrise Movement Asks Sen. Dianne Feinstein to Vote for the Green New Deal; Varshini Prakash, Co-Founder and Executive Director, Sunrise Movement, is Interviewed About Climate Change; Interview With Alec Baldwin. Aired 1-2p ET",/TRANSCRIPTS/1904/29/ampr.01.html,52061,ampr,amanpour
Amanpour,"Pushing Global Leaders to Think Bigger; Mariana Mazzucato, Author, ""The Value of Everything,"". is Interviewed About Her New Book, ""The Value of Everything;"" New HBO Series, ""Gentleman Jack;"" Sally Wainwright, Writer and Director, ""Gentleman Jack,"" and Suranne Jones, Actress, Gentleman Jack,"" are Interview About ""Gentleman Jack;"" Wealth Gap in the United States; Ray Dalio, Founder, Bridgewater Associates, is Interviewed About Wealth Gap; Discussion of Repairs to Notre Dame Cathedral.. Aired 1-2p ET",/TRANSCRIPTS/1904/26/ampr.01.html,52062,ampr,amanpour
Amanpour,"Joe Biden Running 2020 Presidential Election; Bakari Sellers, Former South Carolina State House Member and Amanda Renteria, Chair, Emerge America, are Interviewed About Joe Biden; How Unconscious Bias Plays in Politics and Our Everyday Lives; Jennifer Eberhardt, Author, ""Biased,"" is Interviewed About Her New Book, ""Biased."" Aired 1-2p ET",/TRANSCRIPTS/1904/25/ampr.01.html,52063,ampr,amanpour
Amanpour,"Full Mueller Report for Public View; Dimitri Simes, President and CEO, Center for the National Interest, is Interviewed About the Mueller Report; Trump's Mexico Border Wall; Gov. Michelle Lujan Grisham (D-NM) is Interviewed About the Trumps' Border Wall. Aired 1-2p ET",/TRANSCRIPTS/1904/24/ampr.01.html,52064,ampr,amanpour
Amanpour,"ISIS Claims Easter Sunday Bombings in Sri Lanka; Alaina Teplitz, Mass Funeral in Sri Lanka; U.S. Ambassador to Sri Lanka, is Interviewed About Bombings in Sri Lanka; Washington's Corridor of Power; Gerard Araud, Former French Ambassador to the U.S., is Interviewed About ISIS. Aired 1-2p ET",/TRANSCRIPTS/1904/23/ampr.01.html,52065,ampr,amanpour
Amanpour,"Sri Lanka Easter Sunday Bombings Aftershock; Sri Lanka Government Ignored Impending Attack Warnings; Harsha de Silva, Sri Lanka Economic Reforms Minister, is Interviewed About the Government's Failure to Act on the Warnings; Extinction Rebellion Protests; Jack Harries, Filmmaker and Climate Activist, is Interviewed About Climate Change. Bill McKibben, Author, ""Falter,"" is Interviewed About Climate Change. Aired 1-2p ET",/TRANSCRIPTS/1904/22/ampr.01.html,52066,ampr,amanpour
Amanpour,"Good Friday Peace Agreement Threatened by Brexit; Simon Coveney, Irish Deputy Prime Minister, is Interviewed About the Good Friday Agreement. Democrat Anita Malik Running for Congress in Arizona; Anita Malik, (D-AZ) U.S. Congress Candidate, is Interviewed About Her Campaign; Raising The Issue Of Moral Choices. Aired 1-2p ET",/TRANSCRIPTS/1904/19/ampr.01.html,52067,ampr,amanpour
Amanpour,"Mueller Report Made Public; John Avalon, CNN Senior Political Analyst, is Interviewed About the Mueller Report; David Urban, CNN Political Commentator, is Interviewed About the Mueller Report; Historical Precedent of What's Happening in America; Sean Wilentz, Professor of History, Princeton University, is Interviewed About the Mueller Report. Aired 1-2p ET",/TRANSCRIPTS/1904/18/ampr.01.html,52068,ampr,amanpour
Amanpour,"Measles Makes Deadly Return; Paul Offit, Professor of Vaccinology, University of Pennsylvania, is Interview About Measles; Denialism Over Climate Change; Award-Winning Television Comedy, ""Catastrophe""; Rob Delaney, Actor, ""Catastrophe"" and Sharon Horgan, Actress, ""Catastrophe,"" are Interviewed About Their Sitcom, ""Catastrophe."" Aired 1-2p ET",/TRANSCRIPTS/1904/17/ampr.01.html,52069,ampr,amanpour
Amanpour,"World Mourns For Notre Dame; Nancy Pelosi, U.S. House Speaker, is Interviewed About Notre Dame, Irish Parliament and Brexit; Rebuilding Notre Dame; Simon Schama, Historian, is Interviewed About Notre Dame. Aired 1-2p ET",/TRANSCRIPTS/1904/16/ampr.01.html,52070,ampr,amanpour
Amanpour,"Extinction Rebellion, A Rebellion Against our Extinction; ""Our Planet,"" A Rallying Cry for Urgent Action; Keith Scholey, Series Producer, ""Our Planet"" and Sophie Lanfear, Director, ""Our Planet,"" are Interviewed About their New Netflix Series. Notre Dame Cathedral in Paris on Fire. Aired 1-2p ET",/TRANSCRIPTS/1904/15/ampr.01.html,52071,ampr,amanpour
Amanpour,"Surviving Rwanda Genocide; Forgiveness After the Horror in Rwanda; Denise Uwimana, Rwandan Genocide Survivor, is Interviewed About Rwandan Genocide; Tools Young Women to Succeed in Their Careers; Mishal Husain, Author, ""The Skills; From First Job to Dream Job""; The Skills, From First Job To Dream Job; Life And Death In Rikers Island. Aired 1-2p ET",/TRANSCRIPTS/1904/12/ampr.01.html,52072,ampr,amanpour
Amanpour,"White House Declaring Iran's Revolutionary Guard A Terrorist Organization; Iran Connected to al-Qaeda; Hamid Baeidinejad, Iranian Ambassador to the U.K., is Interviewed About al-Qaeda; ""WikiLeaks"" Founder Arrested; Emily Bazelon, Author, ""Charged,"" is Interviewed About Julian Assange; The Driving Force In America's Mass Incarceration Crisis; Human Trafficking And Veterans Rights. Aired 1-2p ET",/TRANSCRIPTS/1904/11/ampr.01.html,52073,ampr,amanpour
