show,title,href,id,show_abbrev,show_c
Amanpour,Interview with Larry Summers on Trump's Trade Policy; A Friend Describes Mbappe's Rise in Football. Aired 2-2:30p ET,/TRANSCRIPTS/1807/25/ampr.01.html,52247,ampr,amanpour
Amanpour,"Effects of Climate Change Are Felt Across the Globe; ""Far From The Tree"" Brings Light to Families Where Children Are Different Than Their Parents",/TRANSCRIPTS/1807/24/ampr.01.html,52248,ampr,amanpour
Amanpour,Trump's war of words with Iran; Israel helps evacuate Syria's White Helmets; Interview with chemical weapons watchdog chief. Aired 2-2:30p ET,/TRANSCRIPTS/1807/23/ampr.01.html,52249,ampr,amanpour
Amanpour,Conversation with Renowned Military Historian Margaret MacMillan. Aired 2-2:30p ET,/TRANSCRIPTS/1807/20/ampr.01.html,52250,ampr,amanpour
Amanpour,What did Trump and Putin agree to in Helsinki?; WTO chief on US- China trade war. Aired 2-2:30p ET,/TRANSCRIPTS/1807/19/ampr.01.html,52251,ampr,amanpour
Amanpour,The life and legacy of Nelson Mandela; Can Trump mend the damage done? Aired 2-2:30p ET,/TRANSCRIPTS/1807/18/ampr.01.html,52252,ampr,amanpour
Amanpour,"President Trump Faces Criticism of Siding With Russia; ; Many People Are Working Long Hours at ""BS Jobs"". Aired 2-2:30p ET",/TRANSCRIPTS/1807/17/ampr.01.html,52253,ampr,amanpour
Amanpour,Interview with Finnish President Sauli Niinisto on the Trump-Putin Summit; Interview with former US Ambassador to Russia William Burns on the Trump-Putin Summit; Interview with Russian Senator Aleksey Pushkov on the Trump-Putin Summit; Aired 2-2:30p ET,/TRANSCRIPTS/1807/16/ampr.01.html,52254,ampr,amanpour
Amanpour,Trump Criticizes British PM Ahead of Meeting; London Mayor Sadiq Khan Responds to Trump Attacks. Aired 2-2:30p ET,/TRANSCRIPTS/1807/13/ampr.01.html,52255,ampr,amanpour
Amanpour,Interview with NATO Secretary General Jens Stoltenberg; Interview with former Foreign Secretary Simon Fraser on Trump's UK visit. Aired 2- 2:30p ET,/TRANSCRIPTS/1807/12/ampr.01.html,52256,ampr,amanpour
Amanpour,Trump opens NATO summit with criticism of Germany; The scars of Rohingya refugees. Aired 2-2:30p ET,/TRANSCRIPTS/1807/11/ampr.01.html,52257,ampr,amanpour
Amanpour,Trump Tweet Storm; Trump Arrives in Europe for Meeting With NATO; Thailand Rescue. Aired 2-2:30p ET,/TRANSCRIPTS/1807/10/ampr.01.html,52258,ampr,amanpour
Amanpour,Interviews with Matt Damon and Gary White of Water.org; Interview with Lorren Bonner. Aired 5-5:30p ET,/TRANSCRIPTS/1807/09/ampr.01.html,52259,ampr,amanpour
Amanpour,Interview With John Carreyrou On His Investigation Into Theranos; The Toll Of Syria's War. Aired 2-2:30p ET,/TRANSCRIPTS/1807/06/ampr.01.html,52260,ampr,amanpour
Amanpour,Interview with conservative columnist Mona Charen; Immigration: Truths and Myths. Aired 2-2:30p ET,/TRANSCRIPTS/1807/05/ampr.01.html,52261,ampr,amanpour
Amanpour,Interview with Mexico's Foreign Minister Luis Videgaray; A refugee's journey to America. Aired 2-2:30p ET,/TRANSCRIPTS/1807/04/ampr.01.html,52262,ampr,amanpour
Amanpour,The Effects of Undoing Obama Policies - The World is Watching.,/TRANSCRIPTS/1807/03/ampr.01.html,52263,ampr,amanpour
Amanpour,"Interview with former US ambassador to Mexico, Roberta Jacobson; Interview with former US ambassador to South Korea, Christopher Hill. Aired 2-2:30p ET",/TRANSCRIPTS/1807/02/ampr.01.html,52264,ampr,amanpour
Amanpour,Interview With Tony Blair On Globalization And Western Democracy. Aired 2-2:30p ET,/TRANSCRIPTS/1806/29/ampr.01.html,52265,ampr,amanpour
Amanpour,Interview with Attorney General of Washington State Bob Ferguson; Interview with film director Kim Hopkins. Aired 2-2:30p ET,/TRANSCRIPTS/1806/28/ampr.01.html,52266,ampr,amanpour
Amanpour,Interview with Deputy US Secretary of State John Sullivan; Interview with artist Christo. Aired 2-2:30p ET,/TRANSCRIPTS/1806/27/ampr.01.html,52267,ampr,amanpour
Amanpour,Supreme Court Travel Ban Decision Examined; Interview with Candidate for Congress Deb Haaland; Discussion of Activism Among Black Athletes. Aired 2-2:30p ET,/TRANSCRIPTS/1806/26/ampr.01.html,52268,ampr,amanpour
Amanpour,Immigration policies causing chaos and confusion; Saudi women behind the wheel. Aired 2-2:30p ET,/TRANSCRIPTS/1806/25/ampr.01.html,52269,ampr,amanpour
Amanpour,Compelling Stories of Authors Dr. Mona Hanna-Attisha and Jennifer Egan. Aired 2-2:30p ET,/TRANSCRIPTS/1806/22/ampr.01.html,52270,ampr,amanpour
Amanpour,Melania Trump makes unannounced visit to Texas border; The man who could unseat Erdogan. Aired 2-2:30p ET,/TRANSCRIPTS/1806/21/ampr.01.html,52271,ampr,amanpour
Amanpour,Spotlight on the global refugee crisis; Saving the oceans from plastic pollution. Aired 2-2:30p ET,/TRANSCRIPTS/1806/20/ampr.01.html,52272,ampr,amanpour
Amanpour,US religious leaders condemn border family separations; Treating tech addiction as a public health issue. Aired 2-2:30p ET,/TRANSCRIPTS/1806/19/ampr.01.html,52273,ampr,amanpour
Amanpour,Interview with Jeffrey Goldberg; Interview with David Sanger. Aired 2-2:30p ET,/TRANSCRIPTS/1806/18/ampr.01.html,52274,ampr,amanpour
Amanpour,The Dark Side Of The Digital Age; The Positive Power Of Mass Media. Aired 2-2:30p ET,/TRANSCRIPTS/1806/15/ampr.01.html,52275,ampr,amanpour
Amanpour,New York Attorney General Sues Trump Foundation; Interview with South Korean Foreign Minister. Aired 2-2:30p ET,/TRANSCRIPTS/1806/14/ampr.01.html,52276,ampr,amanpour
Amanpour,Trevor Noah Takes London by Storm; Meet the Star Cellist from the Royal Wedding. Aired 2-2:30p ET,/TRANSCRIPTS/1806/13/ampr.01.html,52277,ampr,amanpour
Amanpour,Exclusive Interview With Singapore Prime Minister. Aired 2-2:30p ET,/TRANSCRIPTS/1806/11/ampr.01.html,52278,ampr,amanpour
Amanpour,Ali Soufan On Lessons From 9/11 And Terror Today; How Disruption Of The Ad Business Shapes The Modern Media. Aired 5-5:30p ETp ET,/TRANSCRIPTS/1806/08/ampr.01.html,52279,ampr,amanpour
Amanpour,"Top Iranian diplomat discusses future of nuclear deal; Director Rob Reiner on his new movie, ""Shock and Awe"". Aired 1-1:30p ET",/TRANSCRIPTS/1806/07/ampr.01.html,52280,ampr,amanpour
Amanpour,What to expect from US-North Korea talks; Norwegian prime minister on relationship with the US and tariffs. Aired 2-2:30p ET,/TRANSCRIPTS/1806/06/ampr.01.html,52281,ampr,amanpour
Amanpour,Has U.S.-Announced Tariffs Triggered Trade War With Europe? UN Reports on Extreme Poverty in United States. 2-2:30p ET,/TRANSCRIPTS/1806/05/ampr.01.html,52282,ampr,amanpour
Amanpour,Interview With Winner of Georgia's Governor Democratic Primary; Bernard-Henri Levy discusses his sadness towards the state of Europe. Aired 2-2:30p ET,/TRANSCRIPTS/1806/04/ampr.01.html,52283,ampr,amanpour
Amanpour,The Literary World Loses Two Great Stars. Aired 5-5:30p ET,/TRANSCRIPTS/1806/01/ampr.01.html,52284,ampr,amanpour
Amanpour,"Amy McGrath: Former fighter pilot running for office; ""The People vs. Democracy"". Aired 2-2:30p ET",/TRANSCRIPTS/1805/31/ampr.01.html,52285,ampr,amanpour
Amanpour,Journalist Reported Killed Reappears; Report: Nicaragua Using Shoot- To-Kill Policy. Aired 2-3p ET,/TRANSCRIPTS/1805/30/ampr.01.html,52286,ampr,amanpour
Amanpour,Fighting racial bias in America; Is Big Pharma to blame for the opioid epidemic? Aired 2-3p ET,/TRANSCRIPTS/1805/29/ampr.01.html,52287,ampr,amanpour
Amanpour,"Interview With Pulitzer Prize Winning Author and Vietnam War Refugeee Viet Thanh Nguyen; Interview with Iran Kaveh Madani, a Former Top Envirornmental Official.  Aired 2:2:30p ET",/TRANSCRIPTS/1805/28/ampr.01.html,52288,ampr,amanpour
Amanpour,Trevor Noah Takes London By Storm; Sketching Syria's Civil War. Aired 2-2:30p ET,/TRANSCRIPTS/1805/25/ampr.01.html,52289,ampr,amanpour
Amanpour,President Trump Cancels Summit with North Korea; Glenda Jackson on Her Return to Broadway. Aired 2-2:30p ET,/TRANSCRIPTS/1805/24/ampr.01.html,52290,ampr,amanpour
Amanpour,"U.S. and China ""Playing with Fire;"" ""God Save Texas:"" A Journey into America's Future. Aired 2-2:30p ET",/TRANSCRIPTS/1805/23/ampr.01.html,52291,ampr,amanpour
Amanpour,Trump casts doubt on June summit with North Korea; A portrait of the Pope; Aired 2-3p ET,/TRANSCRIPTS/1805/22/ampr.01.html,52292,ampr,amanpour
Amanpour,Interview with Michael Hayden; Interview with Bishop Michael Curry. Aired 2-2:30p ET,/TRANSCRIPTS/1805/21/ampr.01.html,52293,ampr,amanpour
Amanpour,The Impact Of The Royal Wedding In A Modern World. Aired 2-2:30p ET,/TRANSCRIPTS/1805/18/ampr.01.html,52294,ampr,amanpour
Amanpour,An Insider's View of North Korea Nuclear Talks; A Voice for Reform in Malaysia. Aired 2-2:30p ET,/TRANSCRIPTS/1805/17/ampr.01.html,52295,ampr,amanpour
Amanpour,"Jon Meacham on ""The Soul of America""; Dark Side of Antidepressants. Aired 2-2:30p ET",/TRANSCRIPTS/1805/16/ampr.01.html,52296,ampr,amanpour
Amanpour,"Conversation with Governor of Ohio, John Kasich; A window into North Korea. Aired 2-3p ET",/TRANSCRIPTS/1805/15/ampr.01.html,52297,ampr,amanpour
Amanpour,Interview with Ehud Olmert; Interview with Mustafa Barghouti. Aired 2-2:30p ET,/TRANSCRIPTS/1805/14/ampr.01.html,52298,ampr,amanpour
Amanpour,Ronan Farrow: From Pulitzer Prize Winner To Author. Aired 2-2:30p ET,/TRANSCRIPTS/1805/11/ampr.01.html,52299,ampr,amanpour
Amanpour,"Gina Haspel and a reckoning over CIA torture; Rupi Kaur on identity, writing and social media. Aired 2-2:30p ET",/TRANSCRIPTS/1805/10/ampr.01.html,52300,ampr,amanpour
Amanpour,Former senior EPA official speaks out; UK minister on the scramble to save the Iran deal. Aired 2-3p ET,/TRANSCRIPTS/1805/09/ampr.01.html,52301,ampr,amanpour
Amanpour,Trump withdraws US from the Iran Nuclear Deal. Aired 2-3p ET,/TRANSCRIPTS/1805/08/ampr.01.html,52302,ampr,amanpour
Amanpour,Democracy versus autocracy: A new ideological war. Aired 2-2:30p ET,/TRANSCRIPTS/1805/07/ampr.01.html,52303,ampr,amanpour
Amanpour,"""Factfulness"": Things Are Better Than We Think; ""A Treacherous Path"": Hot War Between Russia And US. Aired 1-1:30p ET",/TRANSCRIPTS/1805/04/ampr.01.html,52304,ampr,amanpour
Amanpour,"UK ambassador to the UN on Iran, North Korea; Gustavo Dudamel on Venezuela and the power of music. Aired 2-2:30p ET",/TRANSCRIPTS/1805/03/ampr.01.html,52305,ampr,amanpour
Amanpour,Iranian ambassador on the concerns over nuclear deal; Costa Rica's president-elect on his surprise win. Aired 2-2:30p ET,/TRANSCRIPTS/1805/02/ampr.01.html,52306,ampr,amanpour
Amanpour,Discussion of Iran Nuclear Deal; Interview with DRC Presidential Candidate. Aired 2-2:30p ET,/TRANSCRIPTS/1805/01/ampr.01.html,52307,ampr,amanpour
Amanpour,Iran nuclear deal hangs in the balance; Israel's Netanyahu addresses Iran Deal after Trump call. Aired 1-2p ET,/TRANSCRIPTS/1804/30/ampr.01.html,52308,ampr,amanpour
Amanpour,North And South Korea Promise Lasting Peace For Peninsula; The World Reacts To Historic Summit. Aired 5-5:30p ET,/TRANSCRIPTS/1804/27/ampr.01.html,52309,ampr,amanpour
Amanpour,Interview with South Korea foreign minister; North Korean defector discusses summit. Aired 2-2:30p ET,/TRANSCRIPTS/1804/26/ampr.01.html,52310,ampr,amanpour
Amanpour,Sweden's crucial role in North Korean negotiations; Confronting racial terror in America. Aired 2-2:30p ET,/TRANSCRIPTS/1804/25/ampr.01.html,52311,ampr,amanpour
Amanpour,Macron-Trump Relationship; Interview with Karl Knausgaard. Aired 2- 2:30p ET,/TRANSCRIPTS/1804/24/ampr.01.html,52312,ampr,amanpour
Amanpour,Interview with Jeffrey Feltman. Maltese Journalist's Son Seeks Justice. Aired 2-3p ET,/TRANSCRIPTS/1804/23/ampr.01.html,52313,ampr,amanpour
Amanpour,Kenya's President Uhuru Kenyatta; Music's Unlikely Duo. Aired 2- 2:30p ET,/TRANSCRIPTS/1804/20/ampr.01.html,52314,ampr,amanpour
Amanpour,"Saving our Oceans from Plastic; Feminist and Novelist on the ""Me Too"" Era. Aired 2-2:30p ET",/TRANSCRIPTS/1804/19/ampr.01.html,52315,ampr,amanpour
Amanpour,CIA director secretly met North Korean leader; David Cameron on new state fragility report. Aired 2-2:30p ET,/TRANSCRIPTS/1804/18/ampr.01.html,52316,ampr,amanpour
Amanpour,WTO chief on risk of trade wars; The story behind Kenya's famous flying doctor. Aired 2-3p ET,/TRANSCRIPTS/1804/17/ampr.01.html,52317,ampr,amanpour
Amanpour,Former CIA Chief Leon Panetta on Syria Strikes and Comey's Book; Russian Reaction to Syria Strikes. Aired 2-2:30p ET,/TRANSCRIPTS/1804/16/ampr.01.html,52318,ampr,amanpour
Amanpour,From Cave To Canvas: The Rise Of Humanity Through Art. Aired 2-2:30p ET,/TRANSCRIPTS/1804/13/ampr.01.html,52319,ampr,amanpour
Amanpour,"The West weighs up strikes on Syria; Macron claims ""proof"" Syria used chemical weapons. Aired 2-2:30p ET",/TRANSCRIPTS/1804/12/ampr.01.html,52320,ampr,amanpour
Amanpour,Christopher Wylie and Zeynep Tufecki Discuss Mark Zuckerberg's Testimony Before the House Energy and Commerce Committee.  Aired 2-2:30p ET,/TRANSCRIPTS/1804/11/ampr.01.html,52321,ampr,amanpour
Amanpour,Trump Pledges Forceful US Response to Syria; Marie Colvin's Family Suing Syria over Her Death. Aired 11p-12a ET,/TRANSCRIPTS/1804/10/ampr.01.html,52322,ampr,amanpour
Amanpour,Russia blames Israel for strikes on Syrian airbase; Trump to make major decisions on Syria. Aired 2-2:30p ET,/TRANSCRIPTS/1804/09/ampr.01.html,52323,ampr,amanpour
Amanpour,Saudi Crown Prince Wrapping Up U.S. Charm Offensive; How Jean Vanier Built A Home For The Disabled? Aired 2-2:30p ET,/TRANSCRIPTS/1804/06/ampr.01.html,52324,ampr,amanpour
Amanpour,"A World Of Challenges; Author Meg Wolitzer Discusses Her Latest Novel, ""The Female Persuasion"". Aired 2-2:30p ET",/TRANSCRIPTS/1804/05/ampr.01.html,52325,ampr,amanpour
Amanpour,Remembering Martin Luther King Jr.; Civil Rights in America 50 Years After MLK Jr.'s Death.  Aired 2-2:30p ET,/TRANSCRIPTS/1804/04/ampr.01.html,52326,ampr,amanpour
Amanpour,"Trump: Military will protect US-Mexico border; Timothy Snyder on democracy, Russia and Trump. Aired 2-3p ET",/TRANSCRIPTS/1804/03/ampr.01.html,52327,ampr,amanpour
Amanpour,Eighteen killed in Gaza border protests; British Labour Party struggles with anti-Semitism; Ruby Wax's new manual for mental health. Aired 2-3p ET,/TRANSCRIPTS/1804/02/ampr.01.html,52328,ampr,amanpour
Amanpour,Exclusive Sexual Assault Allegations At The UN; #Askmoreofhim Asks Men To Stand With Women. Aired 2-2:30p ET,/TRANSCRIPTS/1803/30/ampr.01.html,52329,ampr,amanpour
Amanpour,"North, South Korea Leaders To Meet For Historic Summit; Junot Diaz On His First Picture Book, ""Islandborn"". Aired 2-2:30p ET",/TRANSCRIPTS/1803/29/ampr.01.html,52330,ampr,amanpour
Amanpour,North Korean leader visits China ahead of Trump meeting; Russia warns of retaliations after expulsions. Aired 2-3p ET,/TRANSCRIPTS/1803/28/ampr.01.html,52331,ampr,amanpour
Amanpour,"""Angels in America"" soars back to Broadway. Aired 2-2:30p ET",/TRANSCRIPTS/1803/27/ampr.01.html,52332,ampr,amanpour
Amanpour,Trump appoints John Bolton as national security adviser; Whistleblower behind Facebook's data controversy. Aired 2-2:30p ET,/TRANSCRIPTS/1803/26/ampr.01.html,52333,ampr,amanpour
Amanpour,A Gazan doctor's message of hope and love; A father's mission to save his daughters from ISIS. Aired 3-4p ET,/TRANSCRIPTS/1803/23/ampr.01.html,52334,ampr,amanpour
Amanpour,Former US ambassador on North Korea talks; Students to march on Washington to demand action on guns. Aired 3-4p ET,/TRANSCRIPTS/1803/22/ampr.01.html,52335,ampr,amanpour
Amanpour,"Cate Blanchett: Rohingya plight ""deeply upsetting""; New Orleans' mayor on confronting the South's past. Aired 3-4p ET",/TRANSCRIPTS/1803/21/ampr.01.html,52336,ampr,amanpour
Amanpour,"UK broadcaster exposes practices of Cambridge Analytica; Facebook under fire over data controversy; Tales of life, loss and hope in wartime Syria",/TRANSCRIPTS/1803/20/ampr.01.html,52337,ampr,amanpour
Amanpour,"Putin Re-Elected For Another Six Years; ""The Monk Of Mokha"": A Gripping Quest For Coffee. Aired 3-4p ET",/TRANSCRIPTS/1803/19/ampr.01.html,52338,ampr,amanpour
Amanpour,"Questions Surround Death Of Environmentalist In Iran; ""The Band's Visit"": Egyptians Stranded In Israeli Backwater.  Aired 3-3:30p ET",/TRANSCRIPTS/1803/16/ampr.01.html,52339,ampr,amanpour
Amanpour,Turning Presidential Norms Into Law; The State Of Putin's Russia. Aired 3-3:30p ET,/TRANSCRIPTS/1803/15/ampr.01.html,52340,ampr,amanpour
Amanpour,Ex-CIA director on spy poisoning; Mary Lou McDonald takes the reins of Sinn Fein,/TRANSCRIPTS/1803/14/ampr.01.html,52341,ampr,amanpour
Amanpour,"Changes At State Department: Tillerson Out, Pompeo In; Russia And UK In Standoff Over Spy Poisoning; Building Bridges Between Church And LGBT Community. Aired 3-3:30p ET",/TRANSCRIPTS/1803/13/ampr.01.html,52342,ampr,amanpour
Amanpour,"Wendy Sherman: We Need To Give Diplomacy A Chance; Wendy Sherman: Kim Jong Un In The Driver's Seat; Challenges Surrounding Potential Trump- Kim Meeting; Why The Mayor Of London Is Taking On Tech Companies; London Mayor: ""Reluctant Participant"" In Trump Feuds. Aired 3-3:30p ET",/TRANSCRIPTS/1803/12/ampr.01.html,52343,ampr,amanpour
Amanpour,"Hedy Larmarr: ""The Bombshell"" Who Helped Invent Wi-Fi; The Activism Of Singer Annie Lennox.  Aired 2-2:30p ET",/TRANSCRIPTS/1803/09/ampr.01.html,52344,ampr,amanpour
Amanpour,Taking stock of life for Arab women; Tale of Marie reveals mistrust of rape victims in US,/TRANSCRIPTS/1803/08/ampr.01.html,52345,ampr,amanpour
Amanpour,Sen. Duckworth: A woman of many firsts; Andrew Lloyd Webber's life of music,/TRANSCRIPTS/1803/07/ampr.01.html,52346,ampr,amanpour
Amanpour,Seoul: North Korea Set to Talk to US About Giving Up Nuke; Stalin's Legacy in Putin's Russia; DREAMers in Limbo after March 5 DACA Deadline,/TRANSCRIPTS/1803/06/ampr.01.html,52347,ampr,amanpour
Amanpour,Trump tariff plan sparks major backlash; China's president set to rule his country for life,/TRANSCRIPTS/1803/05/ampr.01.html,52348,ampr,amanpour
Amanpour,Stalin Satire To Release In U.S. After Russia Ban; From Mormon Survivalist To Harvard PhD.  Aired 2-2:30p ET,/TRANSCRIPTS/1803/02/ampr.01.html,52349,ampr,amanpour
Amanpour,Afghan President: Taliban Should Take Peace Offer; Avraham Burg's Journey From Mainstream To Outsider. Aired 2-2:30p ET,/TRANSCRIPTS/1803/01/ampr.01.html,52350,ampr,amanpour
Amanpour,A Gamble For Peace With The Taliban; A Russian Spy Drama In The Era Of Putin. Aired 2-2:30p ET,/TRANSCRIPTS/1802/28/ampr.01.html,52351,ampr,amanpour
Amanpour,"Trump, Russia and the 2018 Elections; Undercover Reporter Exposes Use of Rape by Smugglers",/TRANSCRIPTS/1802/27/ampr.01.html,52352,ampr,amanpour
Amanpour,The Truth About Election Meddling; Michael Ian Black: America's Boys Are Broken And It's Killing Us,/TRANSCRIPTS/1802/26/ampr.01.html,52353,ampr,amanpour
Amanpour,Pinker: Our Lives Are Getting Better; Twitter Co-Founder On Social Media's Dark Side.  Aired 5-5:30p ET,/TRANSCRIPTS/1802/23/ampr.01.html,52354,ampr,amanpour
Amanpour,"Students demand action after Florida massacre; Joan Baez's final ""Fare Thee Well"" tour",/TRANSCRIPTS/1802/22/ampr.01.html,52355,ampr,amanpour
Amanpour,"A Rallying Cry For Gun Control; Anna Deavere Smith Reflects On Race, Poverty And Education.  Aired 2-2:30p ET",/TRANSCRIPTS/1802/21/ampr.01.html,52356,ampr,amanpour
Amanpour,Syria's War Enters A New Phase Of Violence; Silicon Valley's Boys' Club. Aired 2-2:30p ET,/TRANSCRIPTS/1802/20/ampr.01.html,52357,ampr,amanpour
Amanpour,"White House, Kremlin Deny Collusion; Iran and Saudi's Dangerous Middle East Rivalry",/TRANSCRIPTS/1802/19/ampr.01.html,52358,ampr,amanpour
Amanpour,Modern Love in the Age of Tinder; Ridley Scott on Recasting Kevin Spacey.  Aired 5-5:30p ET,/TRANSCRIPTS/1802/16/ampr.01.html,52359,ampr,amanpour
Amanpour,17 Dead After Gunman Targets Florida School; James Rhodes And The Healing Power Of Music. Aired 2-2:30p ET,/TRANSCRIPTS/1802/15/ampr.01.html,52360,ampr,amanpour
Amanpour,"Trump's Lawyer Paid $130,000 of Own Money to Porn Star; Iranian Regime Targets Dual Nationals for Prison",/TRANSCRIPTS/1802/14/ampr.01.html,52361,ampr,amanpour
Amanpour,Bill And Melinda Gates: The World Is Getting Better; Israeli PM Denies Corruption Charges. Aired 2-2:30p ET,/TRANSCRIPTS/1802/13/ampr.01.html,52362,ampr,amanpour
Amanpour,Barack Obama's official portrait unveiled; Can Olympic diplomacy help solve the North Korea crisis? Aired 2-2:30p ET,/TRANSCRIPTS/1802/12/ampr.01.html,52363,ampr,amanpour
Amanpour,Hope For Political Thaw As Olympics Kicks Off In South Korea; David Hockney: Master Of Contemporary Art.  Aired 2-2:30p ET,/TRANSCRIPTS/1802/09/ampr.01.html,52364,ampr,amanpour
Amanpour,"Putin challenger Ksenia Sobchak visits Washington; Jeremy Irons on his ""wonderfully hard"" new play",/TRANSCRIPTS/1802/08/ampr.01.html,52365,ampr,amanpour
Amanpour,Pakistan's role in America's longest war in Afghanistan; SpaceX launches world's most powerful rocket,/TRANSCRIPTS/1802/07/ampr.01.html,52366,ampr,amanpour
Amanpour,The Man Behind The Russia Investigation: Robert Mueller; Britain Celebrates 100 Years Of Votes For Women. Aired 2-2:30p ET,/TRANSCRIPTS/1802/06/ampr.01.html,52367,ampr,amanpour
Amanpour,Trump's nuclear weapons strategy; Aung San Suu Kyi under fire for Rohingya crisis; Documentary puts a spotlight on Rohingya crisis,/TRANSCRIPTS/1802/05/ampr.01.html,52368,ampr,amanpour
Amanpour,Nunes Memo Controversy Overshadows State Of The Union; The Unheard Voices Of The #Metoo Movement. Aired 2-2:30p ET,/TRANSCRIPTS/1802/02/ampr.01.html,52369,ampr,amanpour
Amanpour,Interview With Dr. Bennet Omalu and Brett Favre Regarding CTE. Aired 2-2:30p ET,/TRANSCRIPTS/1802/01/ampr.01.html,52370,ampr,amanpour
Amanpour,"Rose McGowan's rallying cry in ""Brave""; FEMA halts new food and water deliveries to Puerto Rico",/TRANSCRIPTS/1801/31/ampr.01.html,52371,ampr,amanpour
Amanpour,State of Israel-Palestinian negotiations on peace; Kentucky devastated by opioids,/TRANSCRIPTS/1801/30/ampr.01.html,52372,ampr,amanpour
Amanpour,Measuring the success of the Trump election; Chinese influence felt inside the White House. Aired 2-2:30p ET,/TRANSCRIPTS/1801/29/ampr.01.html,52373,ampr,amanpour
Amanpour,"Trump Takes ""America First"" To Davos; The Journalist Who Broke The Larry Nassar Story.  Aired 2-2:30p ET",/TRANSCRIPTS/1801/26/ampr.01.html,52374,ampr,amanpour
Amanpour,Cyril Ramaphosa's future for South Africa; Former Facebook VP: Social media is destroying society. Aired 2-2:30p ET,/TRANSCRIPTS/1801/25/ampr.01.html,52375,ampr,amanpour
Amanpour,President Trump compares himself to Abraham Lincoln; Colombia: Leading a country to peace in a time of war,/TRANSCRIPTS/1801/24/ampr.01.html,52376,ampr,amanpour
Amanpour,U.S. Urges Restraint as Turkey Targets Rebels in Syria; Oscar Nominees Cover Range of Diverse Films. Aired 2-2:30a ET,/TRANSCRIPTS/1801/23/ampr.01.html,52377,ampr,amanpour
Amanpour,"Grayson Perry Discusses the Role of Masculinity in Dealing with Today's Male Roles As Well As His New Book, ""The Descent of Man""; Dean Baquet Discusses the Role of the Media in Reporting National Events.  Aired 2-2:30p ET",/TRANSCRIPTS/1801/19/ampr.01.html,52378,ampr,amanpour
Amanpour,Interview with Former U.S. Secretary of Defense Ash Carter; Interview with South Korea's first Vice Minister of Foreign Affairs.  Aired 2-2:30p ET.,/TRANSCRIPTS/1801/18/ampr.01.html,52379,ampr,amanpour
Amanpour,The DACA Program with 'Dreamer'; Masha Gessen: Putin has created 'A Mafia State'. Aired 2-2:30P ET,/TRANSCRIPTS/1801/17/ampr.01.html,52380,ampr,amanpour
Amanpour,Trump Rhetoric Takes Relations with Pakistan to a New Low; British Author Afua Hirsch. Aired 2-2:30p ET,/TRANSCRIPTS/1801/16/ampr.01.html,52381,ampr,amanpour
Amanpour,Interview with Sen Jeff Flake (R-AZ); Protecting Freedom of the Press. Aired 2-2:30p Et,/TRANSCRIPTS/1801/15/ampr.01.html,52382,ampr,amanpour
Amanpour,"The Executive Editor of ""The New York Times"" Evaluates Donald Trump's Relationship With the Media; Baquet Discusses ""The Times"" Reporting Instances of Sexual Misconduct as Some of the Proudest Work They Have Done This Year; Walter Isaacson Discusses His Recently-Published Book about Leonardo da Vinci.  Aired 2-2:30p ET",/TRANSCRIPTS/1801/12/ampr.01.html,52383,ampr,amanpour
Amanpour,"A Look at Trump's Foreign Policies; Interview with Creators of ""Call Me by Your Name. Aired 2-2:30p ET",/TRANSCRIPTS/1801/11/ampr.01.html,52384,ampr,amanpour
Amanpour,Interview With Meryl Streep and Tom Hanks.  Aired 2-2:30p ET,/TRANSCRIPTS/1801/10/ampr.01.html,52385,ampr,amanpour
Amanpour,Gretchen Carlson's Sexual  Lawsuit;  #Me Too Movement; Interview With Barry Diller Regarding Sexual Harassment in Large Media Companies. Aired 2-2:30p ET,/TRANSCRIPTS/1801/09/ampr.01.html,52386,ampr,amanpour
Amanpour,"Interview With Michael Wolff, Author of ""The Fire and Fury""; Interview With Billy Jean King.  Aired 2-2:30p ET",/TRANSCRIPTS/1801/08/ampr.01.html,52387,ampr,amanpour
Amanpour,Interviews with Sir David Attenboroug and Jane Goodall. Aired 2- 2:30p ET,/TRANSCRIPTS/1801/04/ampr.01.html,52388,ampr,amanpour
Amanpour,Interview with French President Emmanuel Macron. Aired 2-2:30p ET,/TRANSCRIPTS/1801/03/ampr.01.html,52389,ampr,amanpour
Amanpour,Interview with J. K. Rowling. Aired 2-2:30p ET,/TRANSCRIPTS/1801/01/ampr.01.html,52390,ampr,amanpour
Amanpour,Migrants report horrifying stories of kidnappings and slavery; Special report with President of the International Rescue Committee. Aired 2-2:30p ET,/TRANSCRIPTS/1712/29/ampr.01.html,52391,ampr,amanpour
Amanpour,"A Conversation About Ratko Mladic, the Butcher of Bosnia. Aired 2- 2:30p ET",/TRANSCRIPTS/1712/28/ampr.01.html,52392,ampr,amanpour
Amanpour,Madeleine Albright Slams Trumps Travel Ban. Aired 2-2:30p ET,/TRANSCRIPTS/1712/27/ampr.01.html,52393,ampr,amanpour
Amanpour,Iranian president Hassan Rouhani sends the U.S. President a warning. Aired 2-2:30p ET,/TRANSCRIPTS/1712/26/ampr.01.html,52394,ampr,amanpour
Amanpour,Kerry: World Laughing and Crying at U.S. Climate Policy. Aired 2- 2:30p,/TRANSCRIPTS/1712/25/ampr.01.html,52395,ampr,amanpour
Amanpour,The First Black Chaplain to the Queen and Parliament: Reverend Rose Hudson-Wilkin; The Year of Trump; Aftermath of the Grenfell Tower Fire. Aired 2-2:30p ET,/TRANSCRIPTS/1712/22/ampr.01.html,52396,ampr,amanpour
